{
  "id": "sim-001",
  "title": "Simulation: Negotiation with Landowner B",
  "created_at": "2026-01-17T14:30:00Z",
  "source_metadata": {
    "type": "field_log",
    "captured_by": "Staff-007"
  },
  "content": {
    "raw_text": "当初、地権者B氏は強い怒りを示していたが、我々が『祖父の代からの土地への愛着』について理解を示すと、態度が軟化した。この判断は効率性よりも信頼関係を優先したものだ。"
  },
  "git_metadata": {
    "file_path": "",
    "status": "draft"
  }
}
