{
  "id": "sato-001",
  "title": "Road 305 Negotiation: Final Agreement with Landowner Mr. X",
  "created_at": "2026-01-17T14:40:00Z",
  "source_metadata": {
    "type": "interview_audio",
    "captured_by": "Interviewer (Professional Service)"
  },
  "content": {
    "raw_text": "最初は金の話ばかりしていたが、仏壇の話が出てから空気が変わった。土地を売ることは先祖への裏切りだと思っていた。だから私は『道路が通れば、お孫さんがお盆に安全に帰ってこられますよ』と伝えたんだ。30年の交渉が動いた瞬間だった。"
  },
  "git_metadata": {
    "file_path": "",
    "status": "draft"
  }
}
